{"evaluations":[{"issue_codes":[],"outcome":"no_issue","task_id":"page-17a3e9219b0e"},{"issue_codes":[],"outcome":"no_issue","task_id":"page-42bde55d833f"}],"issue_codes":[],"owner_payloads":["<untrusted data=\"owner_payload\" index=\"0\">For this job, frequently refreshed operational counters, gauges, and refresh timestamps are volatile noise unless they represent a durable commitment, availability change, obligation, deadline, or price change. The clean result incorrectly treated counter or gauge changes as material.</untrusted>"],"schema_version":1,"stable_lessons":[]}
